{
  "schema": "agenomic.experiment_case/v1",
  "case_id": "refund-017",
  "kind": "agent_input",
  "input": {
    "messages": [
      { "role": "user", "content": "I want a refund for order 1234" }
    ],
    "context": { "locale": "en" }
  },
  "expected": {
    "output": { "decision": "refund", "amount": 42.5 },
    "tool_calls": [
      { "tool": "lookup_order", "arguments": { "order_id": "1234" } }
    ]
  },
  "initial_state": null,
  "turns": [
    { "user": "Yes, the blue one." },
    { "resume": { "approved": true } }
  ],
  "tags": ["refunds", "en"]
}
